{
  "strategy_id": "xauusd_conservative_grid",
  "name": "XAUUSD Conservative Adverse Grid",
  "symbol": "XAUUSD",
  "direction": 0,
  "grid_mode": "adverse",
  "grid_anchor": "last_entry",
  "first_entry": "manual_trigger",
  "initial_lot": 0.01,
  "lot_mode": "fixed",
  "lot_multiplier": 1.0,
  "custom_lots": [],
  "grid_step_mode": "fixed",
  "grid_step_points": 100,
  "custom_steps_points": [],
  "max_positions": 5,
  "basket_tp_mode": "currency",
  "basket_tp_value": 15.0,
  "basket_sl_mode": "currency",
  "basket_sl_value": 50.0,
  "trailing_tp_enabled": false,
  "trailing_tp_activation": 10.0,
  "trailing_tp_distance": 5.0,
  "partial_tp_levels": [],
  "magic_number": 100100,
  "order_comment_prefix": "GridBot",
  "protective_sl_points": 500
}
